{
  "schema": "pixl.cloudstudio.selftest",
  "v": 1,
  "status": "ok",
  "supported": [
    1
  ],
  "ops": [
    "process",
    "selftest",
    "bench"
  ],
  "worker": {
    "version": "1.0.0",
    "gitSha": "abc1234def56",
    "gpu": "NVIDIA L4",
    "vramGB": 22.5,
    "cuda": "12.8"
  },
  "models": {
    "anvuew-bs-roformer-ft1": true,
    "qwen3-forced-aligner-0.6b": true,
    "qwen3-asr-1.7b": "lazy",
    "htdemucs_ft": "lazy"
  },
  "versions": {
    "python": "3.12.3",
    "torch": "2.11.0+cu128",
    "runpod": "1.12.0",
    "msst": "0.1.0",
    "qwen_asr": "0.0.6",
    "transformers": "4.57.6",
    "demucs": "4.1.0",
    "ffmpeg": "6.1.1-3ubuntu5"
  },
  "wordTimingLanguages": [
    "de",
    "en",
    "es",
    "fr",
    "it",
    "ja",
    "ko",
    "pt",
    "ru",
    "yue",
    "zh"
  ],
  "coldStartMs": 18400,
  "error": null
}
